{"schema_version":"local-monitor-comparison-evidence.response.v1","comparison_id":"018f0000-0000-7000-8000-000000000010","result_ordinal":20,"field_key":"count","items":[{"evidence_ordinal":1,"cohort":"a","session_id":"018f0000-0000-7000-8000-000000000001","state":"included","unavailable_reason":null,"consumed_value":"1","consumed_revision":1,"execution_id":"exec-1","node_id":"node-11111111111111111111111111111111","session_location":"/sessions/018f0000-0000-7000-8000-000000000001?execution=exec-1&node=node-11111111111111111111111111111111"}],"next_cursor":null}